Comments	Pardis	Mina	Yasmin	Average	P_Deviation	M_Deviation	Y _Deviation	P_mislabeling	M_mislabeling	Y_mislabeling	Natalie	Labels	
I'm not even sure I have depression, I think this may just be 'me'.	3	4	4	3.666666667	0.6666666667	0.3333333333	0.3333333333					3.666666667	
I have always been pretty useless socially, but have had a normal upbringing, no horrible experiences, have gone through education fine and even got jobs but I've never enjoyed life, never really cared and normally feel like I'm not really worth anything	4	4	4	4	0	0	0					4	
and, inevitably enventually, will become a burden.	2	0	0	0.6666666667	1.333333333	0.6666666667	0.6666666667					0.6666666667	
I'm not going to be dramatic and say I'm going to end it, it sounds so pathetic (no offence intended to anyone) but I have thoughts of 'going' or even dreams that I could die 'blamelessly' thorugh accident or illness. Selfish I know.	4	3	4	3.666666667	0.3333333333	0.6666666667	0.3333333333					3.666666667	
I have a cycle. Get job, put on confident easy going persona, get physically tired from doing that, lose energy to maintain job, focus on negative, leave job in some form (fired/quit). Friends are much the same, play easy going fun, can't keep it up, lose or push them away. Relationships, get attracted to ones who need help, help them in anyway I can, get to a point where I feel I am no more use so should go as they'd be ultimately better off.	4	4	3	3.666666667	0.3333333333	0.3333333333	0.6666666667					3.666666667	
So, currently I've quit my job as a teacher, couldn't take it - always something to improve and with my way of thinking that just sounds like constantly someone telling you you're useless (and it backing up your own thoughts anyway) but even though I liked aspects of my job I don't think I had a passion like I see in others. I felt I'd let everyone down so disappeared, my partner/ parents got me through immediate days after my sudden departure from work and saw Doc who was nice enough - put me on medication which seemed to do very little - even after a few months. In fact it only had negative side effects so about three weeks ago I stopped taking them completely. I also started seeing a CBT person about three/four session ago but this feels like it's doing nothing at all either, we talk, I'm honest as I can be but there is some element of being 'public' and putting on that face/ jokey responses.	5	5	5	5	0	0	0					5	
I dip between a wish to not be around that is forever there and seems to be backed up with wholly logical reasons that people genuinely struggle to refute to absolutely crashing panic attacks/ given up when my 'theories' are proved.	5	5	4	4.666666667	0.3333333333	0.3333333333	0.6666666667					4.666666667	
I know this sounds odd, but I don't even have the will to get 'better', largely because I don't think I can. I am just 'me'. I am negative, boring and even if it is all just selffullfillng profecies - it's still me who has done that. I'm not blaming life, or others or anything else.	2	4	4	3.333333333	1.333333333	0.6666666667	0.6666666667					3.333333333	
A lot of the posts I read on here seem to have good reason; PTS, loss, finances etc - does anyone have no 'good' reason?	0	0	0	0	0	0	0					0	
I just feel I'm never going to be happy, I am soon to be much a burden on those around me (my gf) and that, in the long run, it'd be better for all if I just went. I know my family and gf love me - but time heals, life would get better and people move on. In the long run I'm sure it wouldn't effect my family and 100% sure my gf would be better off.	4	2	4	3.333333333	0.6666666667	1.333333333	0.6666666667					3.333333333	
Not sure if there is an answer for this, just writing. I'm not angry, I'm not hurt, I'm not even sad as such, I'm just tired...	2	2	1	1.666666667	0.3333333333	0.3333333333	0.6666666667					1.666666667	
"oh im so sorry to read all this, i pretty much feel the same as you, and i often think i wish i never was born, and i find my life a total diseaster, all the wrong decisions i made...im very depressed, taking medication, see counsellor, but in the end its all up to yourself..	5	5	5	5	0	0	0					5	
i wish you all the strength x	0	0	0	0	0	0	0					0	
"Thank you. I wish you luck too. I'm sure you've made some right decisions. Wouldn't it be nice to read about someone who 'recovered' or will we have to live this til the end?	1	0	0	0.3333333333	0.6666666667	0.3333333333	0.3333333333					0.3333333333	
"yes...it woukd be very nice to read about someone who has been suffering from depr. and is now feeling happy and normal again	1	0	0	0.3333333333	0.6666666667	0.3333333333	0.3333333333					0.3333333333	
"You have taken the first step and that is asking for help. It can always be worse. It sounds like you are extremely depressed. I too have had problems keeping jobs and friends.. when I got to the point to where I wanted to end my life, I did something that I've always wanted to do. I went skydiving and all my big problems became very small. I think facing death in an indirect way helped turn my life around. Every time I got to the point to where I was depressed I would go skydiving again. About seven years ago I didn't think it to get worse but I got Dystonia torticollis, that's where your muscles start pulling the wrong way. My head lies on my shoulder and I'm in extreme pain all the time. In between being depressed and getting torticollis I actually became successful until I got torticollis. Please try skydiving jumping out of a plane will help. And remember it can always get worse. If you realize how lucky you are and that ""the big problems in life are really not as big as what you think"" I am now broke and I'm worse off than I've ever been but I feel everyday is a gift. Even though I'm in extreme pain and my body is distorted now for some reason I want to live every minute that I possibly can. Just remember it could always be worse. Merry Christmas	5	5	5	5	0	0	0					5	
"What a fantastic answer, but also a really bad one!! Let me explain...	0	0	0	0	0	0	0					0	
​Firstly I'm very pleased to see you are happy and treat every day as a gift. Obviously I'm sorry you have such daily physical problems but I'm sure that makes you even happier you did the skydiving when you did. I'm really pleased what you did worked for you and it's encouraging to find a rare example of someone who has somewhat defeated depression even if the cost of that has been quite extreme.	0	0	0	0	0	0	0					0	
​But then on the same hand, not recognising how lucky I am isn't the problem, it's knowing that I am and I'm still not feeling good which then further compounds how bad I feel about myself. I know I'm luckier than most, I know things could be worse, I live in an affluent country with water on tap, have good health and had a normal upbringing with no major traumas. So knowing this makes me feel EVEN worse about myself. I see I'm selfish, and ungrateful, and petty and all other words - why can't I just be happy?	3	4	3	3.333333333	0.3333333333	0.6666666667	0.3333333333					3.333333333	
​I've put my life on the line a few times, both within the safety confines of organised activities and on the less controlled activities I may do myself - it doesn't help me. Being near death doesn't impact me positively or negatively - I'm almost apathetic to it.	3	3	1	2.333333333	0.6666666667	0.6666666667	1.333333333					2.333333333	
​And this is why your answer is both fantastic and bad! For you, and others it may work. You are obviously an inspiration to lots of people not only for the physical issues (which are almost a separate issue) but for the fact you have altered your way of thinking in a positive manner. But they also highlight how everyone's issues are unique - and as well intentioned, and even correct, your view that it could be worse it, that can actually make people feel worse.	0	0	0	0	0	0	0					0	
​If we all focused on 'it could be worse' they'd be very few people in this world who could complain, unfortunately it's not that simple. This depression doesn't care that I'm lucky, it just cares that I think badly of myelf and reminds me of it every day and actually accelerates when I speak to people who could argue they do have a good reason to feel bad. I know I don't - and that makes it even worse.	5	4	5	4.666666667	0.3333333333	0.6666666667	0.3333333333					4.666666667	
​Thanks for your reply, I hope I didn't come across aggressively! I'm very happy that you are happy and hope things improve if that's possible for you. Good luck, have a great Christmas and a lovely New Year.	0	0	0	0	0	0	0					0	
"Well, from reading your stuff here it would appear that we think in a similar fashion. Quite obvious really, otherwise why was I searching for other's thoughts on 'being tired of life'!	4	3	2	3	1	0	1					3	
Anyway, having read all of your posts here I'd like to say that I appreciate someone taking the time to punctuate as properly as someone can be reasonably expected to.	0	0	0	0	0	0	0					0	
I read someone here say to get some 'less stressful' work like in a warehouse or something similar, well, let me tell that person that any and all work which involves interaction with other humans is highly stressful, incredibly tiring and seemingly ultimately pointless!	3	0	0	1	2	1	1	INVALID			0	0	
Not having the luxury of either family, friend or partner to bail me out I must work or sleep on the streets within weeks. No other options due to my inability to function as a normal human. Personal responsibility is a wonderful thing.	4	4	0	2.666666667	1.333333333	1.333333333	2.666666667			INVALID	3	3	
It is New Year's Day 2016 and thankfully that (oh such fun and loving) period of falseness is over for another 11 months! I wonder how many more there will be and will they all be quite so alone (not lonely) for me.	1	2	0	1	0	1	1					1	
rsjg, you apparently have some free time on your hands during the days while the bread winner in your team is at work for you. You also sound as though you like to help people and don't currently have any excuse not to try something simple for someone else's benifit. So, what I want you to do with your loose end time is to research (get this right please) High Functioning Asperger's Syndrome for me. Now, I cannot pay you, you will purely be helping me out, there is no end to the research and all you get is satisfaction and something else to think about for a while.	1	1	1	1	0	0	0					1	
How does this sound to you?	0	0	0	0	0	0	0					0	
The reason I ask is purely that I don't have either the time or the inclination to do something for myself as I don't deserve the help from me that others receive without question, oh and the fact that High Functioning AS adults currently don't get diagnosed (labelled) due to them being too clever and the only so called 'real help' out there costs an arm and a leg, both of which I'd rather keep hold of thanks!	3	4	2	3	0	1	1					3	
Please don't pick holes in my punctuation, grammar and sentence building (lack of) skills, I may have also once been a teacher, been measured by British Mensa and found to be an actual genius and have taken ages writing and re-writing this, but I still make mistakes.	0	0	0	0	0	0	0					0	
At least Google - High Functioning Asperger's Syndrome, become a specialist and help people in the future to work smarter with my lifelong challenges.	0	0	0	0	0	0	0					0	
Cheers and Happy New Year	0	0	0	0	0	0	0					0	
"I had a few people on her write to me over Xmas/ New Year but needed to ignore them - too much energy was needed to focus on acting happy and normal around family!	2	2	3	2.333333333	0.3333333333	0.3333333333	0.6666666667					2.333333333	
​I wish I could talk to you more directly than on an open forum. I've said before, knowledge is a great thing - but it can also be a curse. You need to be particuarly careful self-diagnosing but also need to think whether this diagnosis is in any way helpful to you. Say you decide that you are HFAS - how does that help you? If you can't source help then it is just another meaningless semantic for feeling awful day to day.	0	3	0	1	1	2	1		INVALID		0	0	
​I've also mentioned that it is probably important to get outside your own head - think about doing things that stop you thinking about yourself. However, as a caveat, I also recognise doing anything (like talking to another human being as you rightly point out!) can be extrememly stressful.	1	3	0	1.333333333	0.3333333333	1.666666667	1.333333333					1.333333333	
​I'd never pick holes in others punctuation and grammar unless they were doing it to others! It's a forum, not a thesis! However if you have the time and pride to check your message back then maybe you do have the time to look at HFAS if it interests you.	0	0	0	0	0	0	0					0	
​To be honest, knowledge is something I despise yet am addicted to so I will inevitably be searching HFSA after I've written this reply! But without an argument or focus it is impossible to really research a topic to any purpose. I will happily help others if I can (preferably from afar!) but not sure what I could do to focus your research on this matter and whether it'd even be of any benefit to you anyway.	1	0	0	0.3333333333	0.6666666667	0.3333333333	0.3333333333					0.3333333333	
​Like I said, there is certainly an interesting discussion to be had but unfortunately I doubt this is the place to do it effectively for you or I.	0	0	0	0	0	0	0					0	
​Good Luck.	0	0	0	0	0	0	0					0	
"Quick research, scan read. Told you I would... I definitely don't have HFSA. You may well have but it'd take more than a quick chat to establish that.	1	1	1	1	0	0	0					1	
​As I'm sure you're aware, everyone is somewhere on the autistic spectrum and all the various labels that spin off that. Even the most 'normal' of people might feel particuarly calmed by a colour, or get irritated by a simple tapping noise. The issues arise when your 'quirks' impact on your life. Mine do for me, and yours sound like they do for you.	3	3	3	3	0	0	0					3	
​I have had a ton of labels I have both researched or been told about that might fit my ways of thinking and acting but the conclusion I reached was that it was all kind of pointless - a label by its very nature is just a broad title to fit many people and when that comes to the brain it's a very pointless exercise. You might be able to group broken limbs in patients but with the head it's nearly impossible - there's too many bits that do or don't apply for every individual. Ultimately a title is only helpful to point you in the right direction to get you personalised help. And it HAS to be personalised.	3	3	1	2.333333333	0.6666666667	0.6666666667	1.333333333					2.333333333	
​I think I have depression, with social anxiety. I have signs of bipolar, I get symptoms of SAD, I have trichotillomania, I have mild OCD that gets worse if I'm stressed, I have panic attacks, I over think everything, I have low self-esteem and no confidence, I feel suicidal most days and a million other mini-labels. Doesn't help me though. It's the classic 'what's in a name?'	5	5	5	5	0	0	0					5	
​I hope you see my point. We sound very similar yet I would class myself as a people pleaser, I rarely sure emotion outside the house and am overly polite to even strangers. So whilst HFSA might apply in parts, it doesn't solve everything.	3	3	3	3	0	0	0					3	
​Think about what you want from this title. How will it help you? You might be better focusing on the things that make you feel better, not labelling something that makes you feel bad.	0	0	0	0	0	0	0					0	
"Well let's try simplify things yer take a short cut home and trip and break your ankle.	0	0	0	0	0	0	0					0	
Painful and going to take time to heal. You do what's required without a second thought. You think about it you convince yourself that rest and guidance is the key but you never need to question why that day you chose the short cut.	0	0	0	0	0	0	0					0	
The brain however gets a rougher deal if that breaks. You know what you need to do because the experts tell you but why believe them ? Why ? Let's question and even if there right you question how. When. Why me.	0	0	0	0	0	0	0					0	
Jeeze it's an organ.	0	0	0	0	0	0	0					0	
Forgive forget way up see what yer got live now move on.	0	0	0	0	0	0	0					0	
Been there its around the corner. Just let it be	0	1	0	0.3333333333	0.3333333333	0.6666666667	0.3333333333					0.3333333333	
"Mate I can't speak for others but compared to some on this path you are to be applauded. You are nothing short of a perfect human being that I for one would happily share this planet.	0	0	0	0	0	0	0					0	
I don't know when you wrote this or how your feeling now but I am feeling the thoughts.	1	1	0	0.6666666667	0.3333333333	0.3333333333	0.6666666667					0.6666666667	
There is a simple answer for you to feel what others feel but I personally think you should stay where you are and that is to live for the next breath.	0	0	0	0	0	0	0					0	
You however seem to know this and some so I'm guessing you feel similar to me. The answer for you is not to concentrate on the whys his and why not but to keep on doing what your doing and compliment yourself for it as your making the world a better place	0	0	0	0	0	0	0					0	
"I feel the exact same way, we are all lead to believe that we are unique. This is the strangest thing I've ever experienced. I do believe we need to chat together. The way you feel is the exact same as I feel in my life right now.	0	1	0	0.3333333333	0.3333333333	0.6666666667	0.3333333333					0.3333333333	
"Thank you Steve. You've helped me a little and I need all the hlep I can get.	0	0	0	0	0	0	0					0	
"Join the army. Your overthinking and social anxiety is caused by the fact that there is too much in this world. Too many potential opportunities choices and expectations. In the at you have a very simple job and it sets up a routine and discipline.	0	0	0	0	0	0	0					0	
"Big hug & prayers to you Steve. I know this is years later but I can't help but tear up when you speak of dystonia, because my mum had it and I'm sure it was the toughest time in her life. She did recover though with prayer & Botox injections etc. I wish you strength.	0	2	0	0.6666666667	0.6666666667	1.333333333	0.6666666667					0.6666666667	
"I pretty much felt like that most of my life. Moving from place to place whether it is work, friends, relationships or home. Living is just so tiring and it isn't fun or enjoyable. It took me a failed marriage which ended in the most hostile way possible to seek some help. I am slowly and beginning to admit that it is some form of depression. Haven't done the CBT though. Even if you don't think you are suffering from depression, try everything, you never know, something might work for you.	5	5	5	5	0	0	0					5	
"Thank you. I am trying everything but more out of doing what I'm told than having a belief anything will change. I couldn't vouch for CBT yet, it's done nothing. Mind you same for medication! What is depression and what is just character?!	5	5	3	4.333333333	0.6666666667	0.6666666667	1.333333333					4.333333333	
"I have also moved from place to place as a child never had any real friends. Never felt like i fit in. When i do make an effort with work groups people i can only last so long it gets tiring and i cant be bothered. I thought if i did hair from home home that would be better but even then i dread people coming i am sick of that as well. I thought getting married having children would help my quest in searching for happiness but it us all just exhausting even though i love my children . i wonder when is it ever going to end or is life about living in this rat race constantly having scheduals and running aroubd plus trying to fit in seeing people so they dont get annoyed. Its all too mich fir me. I look at peopke who seem so happy ,motivated and excited about life and feell what is wrong with me. I would rathet just be on my own with no scheduals but calmness does this mean i am just a lazy person. I try to be upbeat but it wears off quickly.	4	4	3	3.666666667	0.3333333333	0.3333333333	0.6666666667					3.666666667	
"""What is depression and what is just character?!""	0	0	0	0	0	0	0					0	
I get the impression that you are highly sensitive, empathic, and have high ideals.	0	0	0	0	0	0	0					0	
Let's be honest, there is more bad in this world than there is good. Consciously or not, we're all constantly being barraged with negative messages. And negative emotions have more staying power than fleeting feelings of joy. Your brain is more than likely over stimulated and is compensating / protecting you by dulling your emotions.	0	0	0	0	0	0	0					0	
Think of a traumatic event that you have witnessed (car crash, violent scene in a movie, etc.). Your senses are on high alert, you question yourself as to whether you really saw and heard what just happened, you find yourself in shock.	0	0	0	0	0	0	0					0	
Like shock, depression is a manifestation of our brain's self-protecting powers. It's by no means a comfortable state of being, it leaves one feeling 'flat' (to depress is to flatten), apathetic, tired. But it's an effective mechanism that shields us from feeling intense upset.	0	0	0	0	0	0	0					0	
What you are describing rsjg, is typical depression. I think that you will find that you will cycle in and out of it throughout your lifetime. This is not a character weakness, as you come off as being very honest, insightful, caring, and intelligent.	0	0	0	0	0	0	0					0	
I haven't lived in Brittain (I'm assuming that's where you're from) but here in the U.S. there is tremendous (and unrealistic) pressure to be happy all the time. Nobody can live up to that standard, and 'phonying up' (so others will be more comfortable around you) and living with self - deception is exhausting. If that doesn't rob one of a strong sense of self, depression surely will. The best that we should aim for is contentment.	0	0	0	0	0	0	0					0	
"What a well written submission, and I hope it helped rsjg as it did me. For a long time I have tried to understand why moving to America at first excited me, then overwhelmed me (2 step daughters perhaps?) and then I began having anxiety attacks - something I never had before. You are right, and now, after going through being betrayed, and losing several loved ones, I see quite clearly the happy facade in California around me. It is, as you say, deadening, almost like living in a Stepford Wives movie where you don't fit in.	5	5	5	5	0	0	0					5	
Your description of depression is also very clarifying. I think it was my only way to numb the pain of inadequacy and lost love. I wondered why i had lost my spirit which was once so strong, why I struggled to feel a sense of belonging .... anywhere. Why I looked at myself and wondered who I was.	5	4	3	4	1	0	1					4	
Thank you for your wise words.	0	0	0	0	0	0	0					0	
"Sally! I couldn't agree more! I also feel like that	1	1	0	0.6666666667	0.3333333333	0.3333333333	0.6666666667					0.6666666667	
"Sorry to hear that! If only there were a magic pill.	0	0	0	0	0	0	0					0	
So sorry -- you ended up in probably the worst area of the U.S. to find any meaningful connection. CA (especially L.A. and surrounding areas) is so invested in projecting an image of wealth and superiority. You know, HOLLYWOOD / Tinsel Town...all illusion, no substance.	0	0	0	0	0	0	0					0	
"Oh Tess, how many have said that to me, family and friends, yet I seem rooted to the spot having lost faith in being able to cope on my own or make any meaningful life again. A friend just said to me, Rock Bottom is a safe place to be, it's solid and you can only go up (or sink in the sand?). So I have to believe there is going to be something that will jolt me back into living, hope and believing. Funny, as my husband comes from a Hollywood upbringing.	4	4	4	4	0	0	0					4	
"Hi I relate very much to what you are saying as I have much the same thoughts. I just feel sad and hopeless much of the time and wish my life could end in a natural way. Then I feel awful thinking this with so many people with life threatening illnesses who desperately want to live.	4	4	4	4	0	0	0					4	
I don't have anyone to love me - no partner or kids (I am 60) so you are one up on me. I have 3 sisters and only 1 nephew. 1 sister (who I don't have or want any contact with) has 1 son. She is a snob. Out of my other 2 1 is a recluse and shuts herself away and the other is a thief who stole all our mothers money before she died. So I have no one who would truely miss me. At least you have love and constant people in your life.	2	2	3	2.333333333	0.3333333333	0.3333333333	0.6666666667					2.333333333	
"I doubt you have no one, family is only one part. Work friends? Neighbours?	0	0	0	0	0	0	0					0	
But, for the sake of discussion, if there is really no-one then in a way you know how to feel better and that gives you a lot of power. I don't even know how to be 'happy' and feel I should leave those around me before I drag them down too!	4	3	4	3.666666667	0.3333333333	0.6666666667	0.3333333333					3.666666667	
If you feel lonely, then be a little more proactive, join some clubs or groups etc. Without being offensive, you are a little older than me and there are a lot more clubs set up for your age group than mine that wouldn't be intimidating. I get expectations of sports clubs (loud bravado people!) or nightclubs etc where as I'm sure there are more suitable groups for you. Knowing what you want to make you happy is a great thing.	0	0	0	0	0	0	0					0	
As for your family, you seem to want nothing to do with them. Great! Sorry, people on here may say that's sad etc or to try but it's your situation - if you simply don't get on then absolutely forget them. People survive without families all the time. Or you mentioned the recluse, maybe you need each other...	0	0	0	0	0	0	0					0	
