Comments	Pardis	Mina	Yasmin	Average	P_Deviation	M_Deviation	Y _Deviation	P_mislabeling	M_mislabeling	Y_mislabeling	Natalie	Labels	
"Hello, I feel the same way. I don't feel depressed or manic, I just feel that once I've had enough I see no problem with just ending myself. After all if you were at a party or a club or a bar etc, if you got bored, or didn't enjoy it you would leave, I have just applied this principal to life. I do not find the prospect of living to a ripe old age appealing at all, in fact the thought is horrifying to me. To end up in a chair surrounded by similar types having your bum wiped and being fed by a spoon because your to addled with some sickness to feed yourself - no thanks.	3	3	2	2.666666667	0.3333333333	0.3333333333	0.6666666667					2.666666667	
I haven't spoken about it to anyone, I cannot see the point, what would they do ""try and talk me down.."", why my mind is made up, it has been for several years I'm just looking for the time that suits me.	0	0	0	0	0	0	0					0	
I honestly think there are a lot of people out there who feel the same way as well.	0	0	0	0	0	0	0					0	
"i can relate. the thing is,you can't always believe what your mind says.AFTER YEARS, and i mean years,of therapy, i still have these days when i feel exactly as you describe.On those days,my mind gets locked into that same loop. "" oh whats the use , I'm 65 , ive raised my family,i no longer feel inspired by anything,there's never going to be anything new and exciting in my life,etc. I so easily see the logic in all that. BUT then i remind myself of how much i love a good laugh. Sometimes i can start imagining a comedian doing stand up about my life. My main relief is remembering , I m not always obligated to see me and my thoughts as being inseparable. and sometimes im reminded i am not my thoughts.and then ask myself ,""WHERE the heck did that come from?"" START MOVING START DANCING. i hope you don't mind my 2 cents, but honestly nothing ever stays the same.	5	5	5	5	0	0	0					5	
I wish you peace and love and no expectations.Dale	0	0	0	0	0	0	0					0	
"Thank you. This is helpful and inspiring to me ❤️	0	0	0	0	0	0	0					0	
"This post is 4 years old folks. If you have an issue why not put it up as a new post? x	0	0	0	0	0	0	0					0	
"Hi this post is 4 years old. Just to let you know. x	0	0	0	0	0	0	0					0	
"And yet here you are.	0	0	0	0	0	0	0					0	
Yes it is a rather old post but doesn't mean people can't relate to it anymore. And it just proves that this is a major issue that should be addressed more.	0	0	0	0	0	0	0					0	
I have been experiencing this for the last few months, I have been searching the web looking for answers.  I am a 45 year old female, in good health, I take no medications, thin, active, I eat healthy, so I am at a loss. I have this feeling like there is something under my right rib cage as if something is stuck underneath or enlarged. At first I thought I had strained a muscle b/c I had been working out in the yard the day before it started. It doesn't hurt, it just feels like there is something there that shouldn't be but when I touch the area there is no swelling or bulge. After about 3-4 weeks when it wasn't going away I went to see my doctor. They did blood work, urine labs and sent me for an ultrasound of gallbladder, all came back normal. I have no other symptoms like nausea, vomiting, loss of appetite, etc. just this feeling like something is there. It seemed to go away on it's own and then came back and has come and gone since sometimes lasting a few days, sometimes a few weeks. When it is back wearing a bra is uncomfortable. Sometimes there is a warmth or burning sensation in the area. The only other symptoms I have had that I think are related are these: A few months before this started I experienced a fluttering sensation, almost like when I was pregnant and the baby moved, in the same location, a couple of times. Since this has started, on 3 or 4 different occasions, I have experienced a charlie horse like spasm in the same area, below the right rib, when bending over from a sitting position. Does anyone have any answers as to what this might be?  Does it sound like IBS? Peptic Ulcer?	5	5	5	5	0	0	0					5	
Sounds like a Hiatus Hernia to me - I have one plus lots of other problems too. I too find wearing a bra very uncomfortable most of the time. Do you suffer from Gastric Reflux? Raising the head end of your bed by about 4 ins helps, as it stops the acid coming back in the night. Certain foods aggravate it, ie Acid foods, fatty foods, alcohol.Having an endoscopy will verify this, but need to see an upper GI specialist first. Good luck	5	5	5	5	0	0	0					5	
I am having huge problems I have been ultra sound and blood test done to the max I have a hyena hernia and 3 gallstones had a endoscopy and a colonoscopy I have no relieve and wearing a bra has dug into muscle under breasts from swelling og upper stomache...running out of oprions tried everything stress doesn't help either	5	5	5	5	0	0	0					5	
I have same and had the same tests if you find anything out please let me know it's driving me mad!	1	2	1	1.333333333	0.3333333333	0.6666666667	0.3333333333					1.333333333	
Hi there! I think this thread is old but I just saw you posted a couple months back. I've been having the symptoms for several months (feels like something is stuck under my right rib, not much else) Lab work came back fine. Gallbladder checked out perfectly clear, but it turns out I have a lesion on my liver. Getting an MRI next week. I had sudden chest pain in the middle of the night a few days ago but not again since. Have you had anyone look at your liver?	5	5	5	5	0	0	0					5	
I had a couple lesions on my liver when I went in for an ultra sound and CT scan.....but they said a lot of people do...not to be concerned 🤔, I'm going in for an MRI and a thyroid ultrasound on Friday to find out why I have this bubble feeling under my right rib and now an irratated raspy throat at times....I also have bloating at times....having troubles with constipation.....they said I had a hiatal hernia when they did my colonoscopy and endoscopy, As well as acid reflux but I never had any heartburn until after my tests were done. The Dr put me on Zantac and then Prilosec then I started getting heartburn... So I got off of them and now I get heartburn quite often and it's the type of heartburn that starts in the morning and doesn't go away until I go to bed😣 so I will let you know what the doctors fine on my MRI .....this is very frustrating it's been going on since January😥	5	5	5	5	0	0	0					5	
Good luck! Let me know how that MRI goes. I'm hoping mine will also happen this week. The great thing about an abdominal MRI is they should be able to see pretty much everything so I hope both of us get some sort of diagnosis. I'll report back with what I find!	5	5	4	4.666666667	0.3333333333	0.3333333333	0.6666666667					4.666666667	
Everything looked normal but they weren't able to diagnose the liver lesion. I am having another MRI in November to see if it changes. They believe the liver lesion is an incidental finding and they do not believe the liver is causing my discomfort. I am seeing a GI doc today and having a pelvic ultrasound tomorrow. They want to rule out things like ovarian cancer, cysts, and endometriosis. I will keep you posted! What did you find out?	5	5	5	5	0	0	0					5	
Hello , I had this problem too. I have a hiatus hernia , could not endure it a second time so I have been taken off the lust for an MRI on my liver . When I had an ultra sound my gall bladder was ok but it revealed a light patch on my liver , hence the MRI referral . I was on Lansoprazole for gastric reflux but haven’t taken it for a week as I hate taking tablets permanently. The reflux hasn’t reoccurred as yet but the under the rib discomfort has! Don’t know what to do now?!	5	5	5	5	0	0	0					5	
Was all alright? They saw 2.5 Cm lesion on my liver too- when checking me after a hernia repair as i have abdominal pains after surgery- but after MRI though they said all ok -nothing dangerous. This was 10 months ago but I still have pains under right ribs- Feeling like something is there, bubble feeling? Hurts all the time	5	5	5	5	0	0	0					5	
Where was your hernia?	0	0	0	0	0	0	0					0	
It was an I’m biblical hernia. They said a small one -I could feel it but you couldn’t see it on the outside.	5	5	4	4.666666667	0.3333333333	0.3333333333	0.6666666667					4.666666667	
Umbilical! Not Biblical	0	0	0	0	0	0	0					0	
That's a relief because I thought the Lord gave it to you 😅	0	0	0	0	0	0	0					0	
Hello, My symptoms EXACTLY!!!! post says 2 years ago. How are you? and what happened? This (thing/feeling) has to go! Please reply.	1	4	1	2	1	2	1		INVALID			2	
this is me as well. Started December 13. had a CT and they found nothing so now waiting on HIDA scan for gallbladder. The worst thing for me is if I sit in a car for an extended period. It really aggravates it. Whatever "it" is.	5	5	5	5	0	0	0					5	
So many of us have something similar, and no doctor i have seen has been able to figure it out. I have the same problem sitting in a car, especially for longer drives. It helps me to use a small back support pillow--keeps me from slumping	5	5	4	4.666666667	0.3333333333	0.3333333333	0.6666666667					4.666666667	
Hola Kit, I have a ton of severe stomach issues. I am not a doctor but, I do know that the stomach es actually in the upper left section of the abdomen and the gall bladder es in the upper right section. Although a CT scan has been done and the results came back "ok", it does NOT necessarily mean that everything es perfectly fine with the gall bladder... Not folks that review CT Scans, MRI ' S etc. are skilled... Some doctors may determine that you have "sludge or small gall stones" and not consider it a big deal because medicine claims that the "MAJORITY" of patients have no pain at all... YOU could be in that rare category of folks that have pain. I am no a doctor but, if it does not feel the way that it normally should, there es something going on. Sounds like something in that area may be swelling for whatever reason at times. ...but, the gall bladder can certainly cause those periodic sharp pains... I would definitely obtain a second and possibly a third opinion if necessary. Could be scar tissue... Regardless, do no take it lightly. IFAlso, blood work can be misinterpreted and labs can make mistakes. I certainly will keep you in prayer my friend. 😊	5	5	5	5	0	0	0					5	
your livers in the same area. I would have pains in areas and also feel like something was punching me in rib cage. I was told it was my liver Hardening. since it was struggling. all my results and test came back all my organs were ok. my heart started struggling too. i have a gluten allergy and celiac. it was causing me not to absorb my nutrients. i was severely deficient in iron, d3, Bs ets. for this reason I wasn't creating blood. up until heart doctor who figured it out they kept dismissing and thinking I was losing blood. they weren't listening to me. get checked for deficiencies and allergies. food and internals.	5	5	5	5	0	0	0					5	
I had problems on and off for a few years, discomfort on my right side, pain most of the time after fatty foods, i had every scan going and was told my gallbladder didnt have stobes in, i continued to have discomfort and i knew it was to do with my gallbladder so i asked for it to be removed where they found it was infected etc, this wouldnt show on any scan, it did solve the problem im glad to say.	5	5	5	5	0	0	0					5	
Hi I am experiencing the same problems and was wondering if you found out what is going on? Many thanks	1	0	0	0.3333333333	0.6666666667	0.3333333333	0.3333333333					0.3333333333	
Exact same here .and all test are normal I do have acid reflux and ibs but this feeling doesn't feel normal ha e you found out anything new?	5	5	5	5	0	0	0					5	
Hi, just got back from the specialist. Had an endoscopy, nothing found except reflux as well and a mild inflammation in my stomach. Biopsy all clear. Pain still there. Ultrasound also clear. I am guessing I just have to live with it.	5	5	5	5	0	0	0					5	
Hi I was wondering if u ever found out what was goin on??? I was reading u post and got tickled at the way u described the baby movement feeling I have often described my symptoms the exact same way... any info that u received please share... thanx, J'me	2	4	3	3	1	1	0					3	
I have the same problem. Did you find anything out?	0	0	0	0	0	0	0					0	
I go to another Dr. On Tues. Will try to remember to update u	5	5	3	4.333333333	0.6666666667	0.6666666667	1.333333333					4.333333333	
Thank you. Good luck at the Drs. I had my gallbladder removed so I know it's not that. I feel like it's IBS. So hard to find a good doctor that listens!	5	5	5	5	0	0	0					5	
Hi, ive got that same golf ball feeling under my rib, just annoying and uncomfortable. . Hurts to wear bra? Did you ever get an answer?	3	5	4	4	1	1	0					4	
I could have written this myself! I went to the Doctor yesterday. I have a cat scan and blood work scheduled next week.	5	5	5	5	0	0	0					5	
I too have those very painful Charlie horses in the same area!	3	4	4	3.666666667	0.6666666667	0.3333333333	0.3333333333					3.666666667	
I am thinking it is the muscle that wraps around from your back to the front. I will let you know what my tests reveal! My pain at the moment is bad enough to affect my sleep!	5	5	5	5	0	0	0					5	
Hi Valerie1951, Please DO keep us updated as I have the same problem with the charlie horses in that area and EVERY time I bend over it wants to charlie horse! It's just awful. Thanks!	3	5	4	4	1	1	0					4	
Same here 😦	0	0	0	0	0	0	0					0	
I've had several different feelings under the right rib area. I've had gallbladder removed years ago, full hysterectomy. For several years, I feel random light pinch like pains under right rib in the abdomen area, comes and goes, lasts seconds . Other times, it feels like the ribcage itself that's sore, just on the edge, that pain was also intermittent. I thought maybe poor posture? But now not so sure it's posture related. I've also had awful charlie horse/cramps, muscle spasm in right rib cage. But last 2 weeks, I've had both pains and although they come and go, it's lasting. I have diahrea and some mushy stools but doctor say it's likely IBS and because I don't have a gallbladder anymore. I've had bad reflux last year as well. I thought all of these where not related but will go to doctor this week and check it out. Have you had any results?	5	5	5	5	0	0	0					5	
Have you received a dianosis? Ive got something sumukar occuring now and seeking info.	3	2	1	2	1	0	1					2	
This past weekend I noted what I'd describe as an odd pressure/, sorenessnear near the outer edge of my right rib cage about where my bra crosses. I've been stretching out my right side as it feels like a muscle soreness in some aspects. It's not going away and it becomes aggravated after wearing a bra all day. Another symptom is an odd numbmrss sensation on my skin in same area as the soreness. Looking for info. Thank you	4	5	4	4.333333333	0.3333333333	0.6666666667	0.3333333333					4.333333333	
Update, so the muscle soreness is gone, but now I've got a number if weird blister type spots on my trunk, around my bra line front and back. My issue maybe Shingles, unable to strap on a bra due the intense pain.	4	5	4	4.333333333	0.3333333333	0.6666666667	0.3333333333					4.333333333	
same here but lower than the bra, soreness at the edge of the lower right rib, and/or feeling of pressure, or pinch under the rib. I get muscle spasm like this, I stretch it out as well. What did you find out?	4	5	5	4.666666667	0.6666666667	0.3333333333	0.3333333333					4.666666667	
I have this without the numbness - did you get a diagnosis?	3	3	3	3	0	0	0					3	
HI everybody. new to this forum, but been experiencing same issue for over ten years. I've self diagnosed this to an issue with Hepatic Flexure, which is where youre large intestine folds/turns under your liver. also you can suffer on left side (i don't) with splenic flexure, ie the turn of the colon on the left side under the spleen. This is why pain/discomgort comes and goes. I've had every test imaginable and nothing showed anything other than normal with liver, kidney, pancreas, gall bladder was removed and still discomfort persisted.	5	5	5	5	0	0	0					5	
i've started excercising area to try and minipulate the colon. Hip rotations on my back, roles on back with knees tucked and generally being more active, with specific focus on squashing, twisting and turning this area. HAS defo hrlped relieve the discomfort. I read that these conditions are life long, but not too serious. Keep this post going, keep sharing exercise routines that help.	4	5	4	4.333333333	0.3333333333	0.6666666667	0.3333333333					4.333333333	
Hi. Related to Hepatic Flexure, do you notice if you are constipated is the discomfort is worse?	0	0	0	0	0	0	0					0	
MALS and Slipped Rib syndrome pain are both worse with constipation. Magnesium has helped me a lot with constipation. I've also eliminated white flour from my diet.	5	5	5	5	0	0	0					5	
what form of magnesium do you use for constipation? what amount and how often? thanks	0	0	0	0	0	0	0					0	
Hi sorry I haven't been on here for awhile and just saw ur msg,.....	0	0	0	0	0	0	0					0	
Ur symptoms sound just like mine... they had done blood work on me and it didn't show anything but I kept Complaining that something wasn't right so they sent me for an ultrasound. ... and I am now scheduled for my gall bladder to b removed... I don't know y the blood work didn't show anything but I just had to go with what I was feeling and I knew there was something wrong.... so go with what ur body is telling u ..if it isn't ur gall bladder it could b a hernia, that needs to be taken care of... an ultrasound of the upper body cavity should shed light on ur problem... either way I would ask for more testing....keep us updated... Good luck & God bless J'me	5	5	5	5	0	0	0					5	
Found this discussion in searching my symptoms so glad I have found others with similar symptoms. Please keep updating information, I recently found out I was severely hypothyroid.  I had many symptoms over the last two years that I just chalked up to age, I am 40. I finally went in when I felt the bulge under my right rib cage it really scared me.  I have been on generic synthroid for about three months and feel like a new person, but still have that daily bulge!  I feel like a crazy person and just wanted to add maybe what I have was secondary to my thyriod problem incase you had not had your thyriod levels checked.  I have realized I am not dying and will continue to mention the bulge at bloodwork appointments.	5	5	5	5	0	0	0					5	
Thanks again and goodluck with your surgery.	0	0	0	0	0	0	0					0	
Did you get an answer about the bulge feeling?	0	0	0	0	0	0	0					0	
Well I just wanted to say, I have been experiencing the same problems. In January of this year I had a severe cold found myself coughing a lot. During this time I started feeling something under my right rib area that shouldn't be there. Although I couldn't feel nothing when I would touch the area.... My stomach bloats out at times and then I get a sensation like cold tingly feeling across my diaphragm area. Also when I eat fruit and instantly begin to swallow, I get a sensation in my lower right area of my stomach. So I went to a doctor, they did an ultrasound on me and found nothing. I went to another doctor he ordered me to go in and get a colonoscopy, and a scope put down my esophagus to check to see what was going on. The gastronologist said I have slight diverticulitis symptoms. I had inflammation in my esophagus, due to a slight chance of food allergies, some erosion in my esophagus and a hiatal hernia. They told me to take Zantac twice a day. They didn't go over diet with me or nothing just threw me pills! I have never had heartburn in my life, so it kind of threw me off that they wanted me to take antacid pills. When I started taking antacids....I started getting heartburn.... so I went to another doctor they did a CT scan, blood work, and took x-rays, and found nothing! So right now I am wondering why I'm taking allergy pills, and now I'm on Prilosec but I'm still having the sensations in my stomach and the feeling under my right rib and no one can help me:-(does anybody have any prognosis as to what the feeling under the right rib could be? Could it be the hiatal hernia off to the right side? One of my doctors says the hiatal hernia would be right directly under your diaphragm.... I feel like a hypochondriac and just want some answers...	5	5	5	5	0	0	0					5	
Ask for a HYDASCAN. I went through several months with a pain under my ribs on my right side. Had all the tests mentioned in the string and one I didn't see. There is a test called a hydascan. With this test they found my gallbladder actually had essentially almost stopped working. A week later it was taken out and I was better. So ask for a hydascan if they haven't found anything with the normal tests. Sister and a friend had the same and both only had to suffer for under a month as I recommended the test and they also had theirs removed as they had similar results.	5	5	5	5	0	0	0					5	
Hi I too have a hiatal hernia & have all the same symptoms. Apple Cider Vinegar has definitely helped . I was given Lansoprazole for Reflux but stopped taking it in August . It didn’t return this time . I do find it all quite scary as it really feels look kevthere is something on my right side . I used to get great discomfort & bloating after eating certain things but it has all ceased since taking the vinegar !	5	5	5	5	0	0	0					5	
Did the hital hernia cause pain under right rib below the rib? feeling of something there?	0	0	0	0	0	0	0					0	
Hi Kit4410 I have had this for a few years is it in the left side of the top of the stomach under the ribs if so it is servere constipation you need to take stool softeners best to get prescribed ones from yr doctor.	3	4	4	3.666666667	0.6666666667	0.3333333333	0.3333333333					3.666666667	
I have had these same symptoms for several months. Everything checked out fine but I have a lesion on my liver. MRI scheduled for next week.	5	5	5	5	0	0	0					5	
Anyone receive a conclusive diagnosis?	0	0	0	0	0	0	0					0	
Hello, I have the Same issue some times the pressure is there even if I'm laying flat on my back... And yes for those of us that have been blessed to have children.... It feels like the ninth month baby's head in the ribs trying to stand up... I do have complex cyst on my liver and my kidneys that are small so Dr says that is not the cause so if anyone gets a definitive answer please share... Thank you!	5	5	5	5	0	0	0					5	
I have the same issue, pain under the right upper rib cage so severe I feel like I'm going to pass out! Went to see GP he said gallbladder most likely had an ultrasound & blood test everything is normal. Later that night I was rushed to the ER for the pain, had CT scan and again normal. Went back to my GP the next day & he admitted me to the hospital, they did a HIDA scan my GB was functioning at 10% so they took it out. The surgeon told my family that the gallbladder looked great once they had it out & he doubts that was the problem. 3 weeks post op & I'm still in the same pain feels like when your pregnant & the babies foot gets stuck in your ribs. I'm so frustrated because now I have more issues nausea, vomiting, diarrhea and not eating. I just had a CT scan with contrast and that came back normal too, I have an upper GI scheduled next week & hoping for answers. I can't sit or bend over without feeling like something is going to burst under my ribs	5	5	5	5	0	0	0					5	
I have the exact same feeling and symtoms. Pressure under right rib cage. I also have severe cramps in that area. I feel as if I have a small golf ball stuck under my ribs.	4	5	4	4.333333333	0.3333333333	0.6666666667	0.3333333333					4.333333333	
Vanessa66568 - have you found out any answers? I’ve described my pain in my ribs the same way - feels like you’re pregnant and the baby’s foot is in your ribs. It first started happening after I had kidney stones and I had to have one removed that was stuck. I’ve been told that my kidneys function normally, but my right kidney is slightly enlarged. I’ve had CT scans, ultrasounds, pelvic ultrasounds, and I don’t have my gallbladder. I’ve also tried the chiropractor. I haven’t had issues since losing 35 lbs until yesterday. Ive been nauseous and vomiting and feel like I have the flu, but after reading this thread I’m thinking it might be something else. I’m curious what you have found out from the other tests you had done.	5	5	5	5	0	0	0					5	
Hi , mine seems to be getting worse this week , it’s really worrying me now . I seem to be getting stomach pain with it too . I wish we could get to the bottom of it!	2	3	3	2.666666667	0.6666666667	0.3333333333	0.3333333333					2.666666667	
