Comments	Pardis	Mina	Yasmin	Average	P_Deviation	M_Deviation	Y _Deviation	P_mislabeling	M_mislabeling	Y_mislabeling	Natalie	Labels	
"I'll keep the career talk to a minimum as I think there are probably better places you can get advice on that, either generic or for your specific line of work. What I would say is, unfortunately, you're right not to quit a job without something lined up. I know we watch these 'follow your dreams' movies but in reality you'll still have stuff to pay for and the longer you're out of work the harder it is to explain on a CV as they ask for the reasons behind the gaps and, as much as it isn't, it always just sounds like ""I could'nt be bothered to stick at a job I dislike"". The trick will be finding a way of enhancing your chances of getting to where you want to be through postition, interview, qulaifications or what ever other trick someone more knowledgeable than me will advice. As for not blurring the lines between work and home then you'd be a robot if you could manage it completely!	0	0	0	0	0	0	0					0	
As for the person who commited suicide, you do not have to be anything like them to feel as if parts apply to you - they sounded like they had a plan and then didn't know how to acheive it when life threw a spanner in the works. Sounds a little like you. As I said, this is more professional advice that is needed and getting a doctor to refer you to a psychologist may help, it may only take a few sessions - if desperate you can even book your own for relatively little per session. Don't underestimate how things can effect you even if they don't seem that related. Robin Williams death greatly effected me despite me not being a world famous comedian with millions in the bank or being a performer and life of the party. It was the element of putting on a public front and then eventually 'it' still getting you. It can be tenuous but lots of things might have struck a chord with you.	2	2	1	1.666666667	0.3333333333	0.3333333333	0.6666666667					1.666666667	
To friends. It's a tricky one, on one hand if they did disappear then maybe they weren't good friends, on the other maybe I pushed them so hard they couldn't stay. Furthermore, maybe fear keeps them away - very few people really understand mental health issues, even if you do try to explain it to them. Hard when you can't explain it to yourself! Actually I never really told my friends I had issues, I just pushed them away and they didn't really fight. The one who knew more than others I simply think didn't understand or value the issues. I think ultimately people just gave up! I'm stubborn. Maybe I tested them to some degree too which wasn't fair, when they didn't repsond in the way I hope - everyone lost. I think what you're doing for your current friend will work because you know the thought processes, you know not to say 'just smile' or really irritating things like 'it'll all work out in the end'.... grrr, personal worst sentence you can say!	5	5	4	4.666666667	0.3333333333	0.3333333333	0.6666666667					4.666666667	
It doesn't take courage to change your life, often it takes fear. I normally change my life in a response to the 'fight or flight' response. I have changed everything about my life due to 'this', always with the intention of moving on to better things. But it doesn't work - sometimes you need to not change things and face the issues, otherwise you're just talking them to a new place and starting the same probelms from scratch until you reach the same place all over again. I have moved a fair bit, I have lost old friends and replaced them with new friends who I have now lost again. I have changed jobs to escape bad things and ended up being in exactly the same situation again in each one. I have left lovers because I feared they would be better off without me. I always change, but other than being proven right about my issues that doesn't always help! Sometimes I think it's braver to admit that it isn't because x,y and z keeps happening - it's simply because I am the problem.	1	2	3	2	1	0	1					2	
The list thing is a VERY dangerous plan ha ha. In the few visits to my therapist he suggested something along those lines and thinking about it makes me feel a hundred times worse! I actually can't think of anything that I want to stay alive for, eventually you're going to miss something even if you live to 100! Nothing greatly inspires me, the few things that might (like travel) are too expensive and make me realise how much of a drain on my partner I am. In fact every dream I had is now a nightmare as the reality is they are impossible and even the most positive of person admits that with me. I am plagued by logic and unfortunately, it's rarely disputable. Doesn't matter how much you dream it or want it, you're not going to be the first 75 year old footballer! Reality sometimes gets in the way.	5	5	5	5	0	0	0					5	
So when you get to the point that all your dreams and hopes are unacheivable you die a little. Whe you start realising all the dreams and hopes of those around you are being killed my you too, then maybe that's the time I decide to leave. Anyway....	3	3	2	2.666666667	0.3333333333	0.3333333333	0.6666666667					2.666666667	
I hope your interview went well today, although I get the impression it won't have due to them lining up others. If it does fall through I strongly recommend you don't quit but speak to a a professional careers advisor (I believe they;re available at places like Job Centre? or online) and work out how to get where you want to be.	0	0	0	0	0	0	0					0	
I get a strong feeling that when you're happy in work you'll find that impacts far more on the rest of your life than you realise and everything will begin to feel more manageable or you'll be able to focus on sorting them out without also worrying about work. Good luck.	0	0	0	0	0	0	0					0	
"Yeah I think I am going to different recruiters at the moment and with the ones I've already tried, they've been generally helpful in the past (I guess they want commission at the end of the day). The idea of quitting has become stronger as quite a number of people in the company have quitted , been sacked or made redundant recently, they've gone to do different things, new jobs, travelling etc. or just a break and I guess that idea of leaving, it just comes in my head more.	0	0	0	0	0	0	0					0	
No course not - I remember I was upset in a similar way when I once read an article of a couple who suicided and I started thinking about the reasons they did (I won't go into it as it is depressing and sad) when I was reading the article. I assume with when Robin Williams passed away it was because he was a big figure when you were growing up? Or maybe the due to the characters he represented?	1	1	1	1	0	0	0					1	
I know what you mean, I do feel with those that left me I was partly to blame, but at the same time they were really not the people I wanted to be around with. Say if I was able to go back in time, I COULD'VE gone to the doctors or something to take some time off work to get away from work environment, and maybe spoke to those friends back then outside in private. That most likely would've kept the friendship but then again, I think my career and work would've been affected negatively. Oh god I hate those comments!	1	1	1	1	0	0	0					1	
THAT, is one of the worst things you could say to a person. I had something along those lines... ""If you keep working you will get out of it"" or something like that. Asking someone who's very close to completely losing the will to carry on to find some strength from nowhere is a very harsh thing to say, it’s like pushing someone who’s standing on a cliff edge.	1	1	1	1	0	0	0					1	
I remember one of the “friends” was upset because I didn’t tell them the issues I was having, and that they heard from another person who had… “I’m very upset that you didn’t talk to me about this”, but didn’t touch the actual subject of why I was feeling down, I just remember thinking “do you actually care about anyone but yourself???”. Maybe I’m just being bitter.	1	1	1	1	0	0	0					1	
I guess that’s the difference… are you doing something because you want to do it, or because you don’t want to be where you are at the moment? When you go from one job to the other, is it similar kind of job? Does the job itself not suit your personality? Like I know I never would be a salesman. I’m so much better at handling complaints (probably due to my listening habits) than being a pushy salesman, last time I changed jobs it was because my old job started to become sales focused. Haha at least you find a lover, you must have a fairly decent level of attraction, I haven’t been in a proper relationship… the closest one was when they cheated on their partner with me, and that sort of scenario has happened with me quite a few times. This seems to stem from the listening thing as well, troubled relationship, the opposite sex who will listen to them and then get with me.	1	1	0	0.6666666667	0.3333333333	0.3333333333	0.6666666667					0.6666666667	
Ok, don’t make a list haha. But just to give you an idea, when I made mine, the bad was just the “Work” and “Family”(Or “Parents” specifically), and for the good I listed all the TV shows, movies, places I want to go and see at some point in my life, restaurants or food I like eating, sports team I support and even unrealistic things like a Lamborghini (though I could probably go on those test drive things one day). When you talk about the logic – is it the age thing? So you can’t do something because you’re too old? I’m obviously not gonna say something stupid like “you shouldn’t give up”, somethings you just can’t do. Like that family member of a friend who killed himself, by the time he was back to full fitness from a serious injury he was over what the general idea of “peak age” of a sportsman’s career, and (from what I can make out) he was just not the talented promising star that he once was.	0	0	0	0	0	0	0					0	
Thank you, the interviewers and I were pretty engaged in conversation but I don’t think I answered the questions as effectively as well as I had hoped. Not end of the world, just because a team of people concluded that I wasn’t good enough for that role it doesn’t mean there’s no one out there that is better for me. Job Centre is probably a good idea though, at least I can get an idea of steps to take. Already applied for external jobs just need to hear back.	0	0	0	0	0	0	0					0	
Yeah I never been the type to work for long term plans, I know people say you should have a target etc. but if I can’t see a relatively instant result I don’t have the motivation. I did struggle at school because of this, because I couldn’t understand why what I was studying was relevant to my life. But when I went into a job and learned something new, I would pick it up so much quicker than those around me. I don’t know what it is… maybe I’m just a lazy person haha.	2	1	0	1	1	0	1					1	
If you do want to talk about your current state, just say. I'm happy to listen.	0	0	0	0	0	0	0					0	
"Hey just a note to say I hope the job thing has become clearer over the last few days and that I had read the message, I just had brain freeze and didn't know what to write - I kind of still have it. Definitely can tell when very low as my mind shuts down, my spelling and grammar become appalling and I can't be bothered to re-read and edit!	4	4	0	2.666666667	1.333333333	1.333333333	2.666666667			INVALID	3	3	
​You sound clearer though, even over a few days which is briliant. I firmly believe all that is needed for most people is a plan and hope. People don't want everything to be perfect, they just want hope that is could be. Take that confidence you have in your abilities and let that be your focus for now, get the job sorted and then come back on here if and when you still feel you need support.	0	0	0	0	0	0	0					0	
​That's not to say you're not welcome!! I just don't think it's healthy necessarily to focus on how you feel... that kind of makes no sense! I mean you need to look outward as focusing on yourself (certainly does for me) makes me feel worse and it's almost better to just live life rather than do ANY thinking!! I hope that makes sense!	1	1	1	1	0	0	0					1	
I've read your post a few times when depressed and Googling. All I can say is that there are many people out there who feel the same as you do. Not all of them jump online and say as much, though. I won't say that life ""gets better"", but I will say that emotions are temporary. Even if you feel very bad right now, there will be times when you feel better, even if it's just temporary.	5	5	5	5	0	0	0					5	
"Thank you for your message. I do realise that feelings/emotions/depression has its ups and downs but my main issue is my 'peaks' are still bad - at my best I am just a little down or lack enthusiasm, during my dips it's perhaps more 'critical'. I worry that if those 'peaks' are it then there really is little point. I hope you find better periods of happiness than I do!	5	5	5	5	0	0	0					5	
"I feel pretty much the same,im 21 got a job that i seem to enjoy, im very socially awkward not many friends if any.. wake up in the morning just feeling like i wish i could sleep all day takes my mind of having to think how bitter and horrid i feel about my life, was brought up well althought i suffer from ADD pretty much tell my self almost everyday how sick and tired i am. Like yourself i also think about if i died in a accident or illness doesent really make me worried infact i sometimes think it would be better my family are very supporting just never tell anyone much about myself a bit of a recluse never really see a light at the end of the tunnel and i think this just makes me more tired ... thanks for your post and pleased other people feel the same as me .	5	5	5	5	0	0	0					5	
I apologise about the bad grammer	0	0	0	0	0	0	0					0	
"Hi, thanks for writing in the thread.	0	0	0	0	0	0	0					0	
​Although I am very guilty of not doing this myself (although I have tried and it's still not great!) I always think it's a good start to focus on those things that are good and not the negatives. I've said before, hope is more important than success - not saying you or anyone else have reasons for hope as that's impossible to say to a stranger, but that if you as an individual can find it then great.	1	0	0	0.3333333333	0.6666666667	0.3333333333	0.3333333333					0.3333333333	
​You're young, that's definitely a plus. I do feel the quicker things are addressed the better so proactively take steps now to deal with it rather than waste 10-20 years wondering what if. Social awkwardness is understandable (trust me I'm nearly an expert!) but not unsolveable even in small amounts - especially when you are so young - the change from 21 to 30 is probably close to the change from 12 to 21. the fact you're even writing on these boards at such an age shows you have a good idea something isn't 'right'.	1	1	1	1	0	0	0					1	
​As for the positives, you say you ENJOY your job. Hell, you have and seem to be able to hold it. Three positives there in itself. Many friends is still some friends - don't focus on who's missing, have great fun with those you do have. Despite what social media would imply, most people only have two or three close friends and everyone else is an aquaintance - they might be overtly friendly and chatty but they wouldn't share or trust anything with them.	0	0	0	0	0	0	0					0	
​So do you know what it is that makes you feel as you do? Have you seen a doctir yet? That should always be your first port of call - it is rarely a quick fix but some of these feelings (and sick and tired springs out) can be attributed to things that CAUSE depression and not from the EFFECT and may be solveable by increasing iron or another vitamin deficiency. If the Doctor then says you're fine, they may point you in more useful directions if it's a mental health problem. Just check physical before writing it off.	0	0	0	0	0	0	0					0	
​If you knwo more exactly what makes you unhappy then is there anyway to resolve it? Can you create a hope through actions - not solve it immediately but foresee a time when it will be.	0	0	0	0	0	0	0					0	
​Being quiet, reclusive or shy is not a bad thing. We are led to believe it is in this society and the confident extroverts will inevitably rise to the top (sometimes without merit) but it takes all sorts to keep things ticking and you are going to be much more suitable for some people (work and relationships) than those who display things you 'lack'. I'd always trust the quiet truth talking thinker over the extroverted quick chatting b*ll person!!	0	0	0	0	0	0	0					0	
​I never mark grammar on a forum. It's for chatting, not education or essays and anyone who does is a bit sad... so I often mark them in retaliation!	0	0	0	0	0	0	0					0	
​Good luck with what ever step you make next. All I would request is you make a step, choose an avenue to investigate and try it. If you get to the end of the journey and still feel as you do, come back - I'll know exactly where you stand...	0	0	0	0	0	0	0					0	
"Hey thanks for replying, probably the feeling of being different is what gets too me always feeling i need to impress people and the feeling i am always being judged i was judged alot when i was in school due to my ADD and never feel it has left me even though i no longer rely on medication , feel asthough i have too try 10 times harder than everyone else to get too where i am or want too be and it just wears me out. I always feel like im the one thats just there not really wanted or needed always given the cold shoulder and just mess everything up.	5	5	5	5	0	0	0					5	
I have read a few forums on ADD running through to adulthood and a few of my problems do relate to what they say and can increase risks of depression not sure if this matters or if im over exagerating,i rang samaritans a few months ago but just couldent find the confidance to tell them my problems so i hung up,so not sure if i could do it face to face(with a doctor)	5	5	4	4.666666667	0.3333333333	0.3333333333	0.6666666667					4.666666667	
Thanks for taking time to reply	0	0	0	0	0	0	0					0	
"I don't know enough about ADD in adults but you seem to have already discovered there is probably a link between how you feel and ADD so, for me, surely that's something to investigate.	2	2	0	1.333333333	0.6666666667	0.6666666667	1.333333333					1.333333333	
Seeing a Doctor or speaking to the Samaritans is tricky, I understand that but if you can go in with an idea that it might be linked to ADD then you may find a chat with a doctor actually relevantly concise and fruitful.	1	0	0	0.3333333333	0.6666666667	0.3333333333	0.3333333333					0.3333333333	
If I was at a point where possibly restarting some medication I've been on before could make me feel ten times better and I just needed a chat with my Doctor I'd do it. Going in and asking for help when you don't know what's wrong at all is scary or feels pointless but I think you know it might actually get results.	3	3	2	2.666666667	0.3333333333	0.3333333333	0.6666666667					2.666666667	
Sort out the easier stuff first. You may find it helps stuff you weren't even aware of.	0	0	0	0	0	0	0					0	
"i think i can understand how you feel cuz most of the time i myself feel like this... everything seems to be exhausting me, no matter what i do... everything has become so boring that death seems so much interesting, though i'm not going to kill myself but just as you said i also wish something were to happen to me.	4	4	4	4	0	0	0					4	
"I'm not sure I would say death was interesting. For me, death is nothing, no thoughts, no peace but just complete nothing. I'm not going to be able to be pleased or regret being dead, I will not know anything from the moment my last breath leaves me and whatever happens to those I care about I will not be able to be happy or sad about. That's death. An ever lasting dreamless sleep.	0	0	0	0	0	0	0					0	
It may still be preferable to a living state where there is no happiness. Furthermore I've often argued/ thought that my death may have more positive ramifications than negative ones but I'll never know for sure.	2	2	2	2	0	0	0					2	
You need to work out what it is that makes you feel like you do. Is it physical or mental exhaustion? What bores you? Does anything excite you or give you hope? What is the barrier to you being happy?	0	0	0	0	0	0	0					0	
I don't think all barriers can be removed but I think you need to identify them as best you can before you give up.	0	0	0	0	0	0	0					0	
"I really don't know... living has become boring but sometimes i really look forward to life that maybe something will happen but unfortunately nothing does.	4	3	1	2.666666667	1.333333333	0.3333333333	1.666666667					2.666666667	
I know i might sound crazy for saying that death seems interesting but it really does... i don't know if interesting is the correct word, its more like being alive is so troublesome... why be bothered when you can just not exist at all, it will be so much peaceful.	4	4	4	4	0	0	0					4	
Well really thanks for listening to me and i don't think i'm going to up so soon.	0	0	0	0	0	0	0					0	
Thankyou	0	0	0	0	0	0	0					0	
"I just happened to be checking my emails as this came through - so your timing is good!	0	0	0	0	0	0	0					0	
​It's so hard not to sound chocolate boxy when trying to give advice to situations and people you know only through a few sentences. However I have to try!	0	0	0	0	0	0	0					0	
What do you really look forward to? Like always, I'm not saying answer that on here but ask yourself. Why isn't it happening? Is there anything you can do to help it happen? Do you need to do something to create a change or push yourself out your comfort zone? If you've tried and couldn't do it, or failed for a multitude of other reasons then I can completely empathise. If you can't even try is there a reason there that you could approach? Sometimes dealing with the inability to try might help you get the thing you actually want. If that makes sense! Nothing happens without action from somebody though, it's nice if others provide it but you can only guarantee it if you do it.	0	0	0	0	0	0	0					0	
​As for death you're kind of right, although we're not supposed to admit it. We weren't alive before and we will be dead one day and the world will keep on turning and billions of people around the world won'y even know. But it won't be peaceful, it won't be anything. Don't think of death as being anything, anyone who imagines what life is like after they're gone is missing the point - there is no imagining, no peace, nothing. Focus on the living and how you can make that better. That doesn't mean I don't understand, empathise and even agree with you that life isn't worth living but you have to quantify that with what your life is like now, if it really is awful and makes you cry everyday and there is no hope then I understand the wish to depart, but it is only as a means on ending the pain it does not bring happiness or relief or peace - it brings nothing. The question is, is nothing better than living? I'm not going to try and answer that with such limited information - what I will say is I believe in euthanasia for those with incurable pain (much like the mind?) but also believe those that can be cured should not take that route. Can you be cured? Can I?!	1	2	1	1.333333333	0.3333333333	0.6666666667	0.3333333333					1.333333333	
​You need to speak to someone a lot more qualified than me. You need to make sure all the basics are ticked off; are you physically lacking in certain areas which is causing depression/ tiredness, are you suffering from some form of trauma, have you got an issue from which everything stems from? Once you've ruled out all these then I think it makes decisions and thought processes clearer. Lile a medical diagnosis - make sure it's not the simple stuff and then see where you go from there.	0	0	0	0	0	0	0					0	
​People on here will always listen. If life is boring, do one thing next year that you think might be exciting and see if that changes anything. Move area, get a new job, go on a brave backpacking holiday, do something that isn't 'you' - then see how you feel. Or, maybe more sensibly, just speak to someone and see what comes out.	0	0	0	0	0	0	0					0	
"thanks rsjg	0	0	0	0	0	0	0					0	
i'm really trying to move on from this mindset of mine and i think i'm doing some progress too. though there are moments these thoughts strike again. its really wierd you know... but really thanks for listening to me, my family thinks i'm just imagining things and that i'm just lazy and don't want to do anything, and my friends... well, nevermind. i think i'm better now and really thankyou!	3	2	3	2.666666667	0.3333333333	0.6666666667	0.3333333333					2.666666667	
"Another one for the 'signed up just to reply club. Given that some days In struggled to raise a tut towards the Katie Hopkins column in the Daily Mail I would ask you to recognise the gravity of this.	3	0	0	1	2	1	1	INVALID			2	2	
As it goes I don't much to say. I stumbled on this the way many others have: Why am I so rubbish. Why am I tired of life. Everything is generally pants and I'm not sure I care enough to do anything about it.	4	4	4	4	0	0	0					4	
I have some form very similar to yours but that's not the purpose of the post.	0	0	0	0	0	0	0					0	
Just wanted to say I very much like the style of your writing. Not sure what you can do with that. I was going to suggest becoming an author. I saw the whole JK Rowling thing happening for you. Then I read the not a fan of rejection bit which probably scuppers that.	0	0	0	0	0	0	0					0	
