Comments	Pardis	Mina	Yasmin	Average	P_Deviation	M_Deviation	Y _Deviation	P_mislabeling	M_mislabeling	Y_mislabeling	Natalie	Labels	
My bloods have returned to near normal. I am now trying to reduce by 1mlg a month but I have now gone to taking half in the morning and half before I go to bed.	5	5	5	5	0	0	0					5	
This has enabled me to do more things in the mornings as before it was impossible because my head was not in a good place.	2	1	2	1.666666667	0.3333333333	0.6666666667	0.3333333333					1.666666667	
We are all managing this horrid situation individually, but I do feel positive that it has worked for me.	1	1	0	0.6666666667	0.3333333333	0.3333333333	0.6666666667					0.6666666667	
I couldnt even lift a cup in the mornings when first diagnosed.	5	5	4	4.666666667	0.3333333333	0.3333333333	0.6666666667					4.666666667	
Check with your doctor. 15 might have been enough to 'knock it back' but not keep it down, speaking of inflammation. Beware of big drops in mg and unnecessarily big jumps back up. Question every thing your doc does/says/prescribes. Is it a rheumatologist or another doc? You want a specialist in steroid use which is more rheumatologist than GP. These forums have taught me more than my doc has had time to educate me. But ultimately I lean toward his knowledge. I have learned invaluable understanding from forums in regard to what questions to ask my doc. Make list before you go!!	5	5	4	4.666666667	0.3333333333	0.3333333333	0.6666666667					4.666666667	
Hi Clicklaura, I have found with a flare that I have been to up my dosage double, then triple for 3 or 4 days. Then reverse the amount and days on the same schedule as I increased. Stopping the flare and getting the inflammation under control. Unfortunately I have had too many flares in the almost four of my PMR journey. My first bad flare was not controlled and I increased from 7mg to 30mg in very small long increases. I have been taper from that experience 3 years in May. We are all individuals each case is different. DSNS method works that is one thing I believe is true for everyone. Good luck!🙂	5	5	5	5	0	0	0					5	
at the moment my right hip is so sore i can hardly put weight on it!	4	4	4	4	0	0	0					4	
my dose has been increased to 17.5mg from 15mg .	5	5	4	4.666666667	0.3333333333	0.3333333333	0.6666666667					4.666666667	
Due to the current climate there is no chance i can get to see a specialist.	4	4	0	2.666666667	1.333333333	1.333333333	2.666666667			INVALID		2.666666667	
Oh I know what that's like! In the interim try a heating pad or hot shower or bath. The best is a steroid shot but upping steroids I never did that just for the hip.	5	5	3	4.333333333	0.6666666667	0.6666666667	1.333333333					4.333333333	
Hey guys. My name is Brett. I have some numbers I'd like to share as well as my personal symptoms to see if anyone can give me guidance on how I can be healthier.	4	2	3	3	1	1	0					3	
General info:	0	0	0	0	0	0	0					0	
Age 24, male, 5"11', 190 lbs, caucasian of Hungarian and Irish descent. I have rod-cone dystrophy, probably unrelated, and the gene variants C282Y and H63D variants in the HFE gene. I've been tested for iron problems, but none came back out of normal levels. The numbers below are related to those tests. If you can give me any advice unrelated to those results, that is welcome too. Just trying to give a complete picture	5	5	5	5	0	0	0					5	
First off, my primary issue is my bones. I have some arthritis in my neck but never had my hands x-rayed, but my neck doesn't hurt while my hands do. Doctors have been little help because they probably think I want pain meds, which I don't, I simply want to know why my hands hurt. Being visually impaired, they're my most useful tools and I don't think I can live a happy life if I don't get an answer and this keeps getting worse. My hands are always uncomfortable, but actions such as typing turns it into pain nearly immediately.	5	5	5	5	0	0	0					5	
Other symptoms:	1	0	0	0.3333333333	0.6666666667	0.3333333333	0.3333333333					0.3333333333	
Low energy( I sleep for 10 hours every day and I still don't want to get up. I don't work.)	3	3	2	2.666666667	0.3333333333	0.3333333333	0.6666666667					2.666666667	
Lethargy(worst in the morning, gets better at night)	2	0	0	0.6666666667	1.333333333	0.6666666667	0.6666666667					0.6666666667	
Social anxiety	1	0	0	0.3333333333	0.6666666667	0.3333333333	0.3333333333					0.3333333333	
Depression	1	0	0	0.3333333333	0.6666666667	0.3333333333	0.3333333333					0.3333333333	
Apathy	1	0	0	0.3333333333	0.6666666667	0.3333333333	0.3333333333					0.3333333333	
Receding hairline	1	0	0	0.3333333333	0.6666666667	0.3333333333	0.3333333333					0.3333333333	
infrequent mania(every 2 weeks or so I feel like I can take on the world for a single day)	4	4	4	4	0	0	0					4	
high libido(always been that way), but I have no interest in finding or having a partner.	4	4	4	4	0	0	0					4	
easy skin discoloration(if I scratch an itch or wear a hat, my skin is visibly marked. People often ask if I'm allergic to things because they notice the redness.)	4	4	4	4	0	0	0					4	
Trouble falling asleep(I'm also a light sleeper, but assuming nothing goes bump in the night, I sleep straight through. No dreams though, almost ever.)	4	4	4	4	0	0	0					4	
I don't know the word for it, but if I'm not wearing a shirt, my entire back itches.	3	3	3	3	0	0	0					3	
Tinnitus(loud ringing when quiet)	1	0	0	0.3333333333	0.6666666667	0.3333333333	0.3333333333					0.3333333333	
tingling in hands, usually after activities like typing	2	0	0	0.6666666667	1.333333333	0.6666666667	0.6666666667					0.6666666667	
I've been described as obsessive-compulsive due to my buying habits(supplements), though I understand the likelihood of these things helping is not great)	4	5	4	4.333333333	0.3333333333	0.6666666667	0.3333333333					4.333333333	
I can't think of anything else right now.	0	0	0	0	0	0	0					0	
I don't take any medication. I drink between 200-400 mg of caffeine in the form of coffee and I use various nicotine products. Usually a vape, sometimes gum, sometimes cigarettes. My pain didn't get better when I quit nicotine and coffee for 6 months, but my energy/mental health got worse, so I started again. I've tried anti-depressants in the past but they didn't work great or they had side effects.	5	5	5	5	0	0	0					5	
I've tried every supplement I can get my hands on and nothing helps any of my symptoms, but I'm desperate. I feel like time is wasting in my effort to live any resemblance of a happy life and I'm only moving backward in the meantime. All of the things I like doing require my hands and I've stopped doing them all due to pain.	5	5	5	5	0	0	0					5	
Here are some numbers. Can you give me any guidance on what might be wrong and what I can do? One other thing I want to know is, based on these, would it be safe for me to give blood regularly to lower iron, and if so, is it possible that it might make a difference in how I feel?	4	4	4	4	0	0	0					4	
Iron 108 ug/dL	5	0	0	1.666666667	3.333333333	1.666666667	1.666666667	INVALID				1.666666667	
TIBC 234 ug/dL	5	0	0	1.666666667	3.333333333	1.666666667	1.666666667	INVALID				1.666666667	
Transferrin Saturation 46 %	5	0	0	1.666666667	3.333333333	1.666666667	1.666666667	INVALID				1.666666667	
Ferritin 284.0 ng/mL	5	0	0	1.666666667	3.333333333	1.666666667	1.666666667	INVALID				1.666666667	
WBC 6.81 k/uL	5	0	0	1.666666667	3.333333333	1.666666667	1.666666667	INVALID				1.666666667	
RBC 4.75 m/uL	5	0	0	1.666666667	3.333333333	1.666666667	1.666666667	INVALID				1.666666667	
Hemoglobin 15.1 g/dL	5	0	0	1.666666667	3.333333333	1.666666667	1.666666667	INVALID				1.666666667	
Hematocrit 44.8 %	5	0	0	1.666666667	3.333333333	1.666666667	1.666666667	INVALID				1.666666667	
MCV 94.3 fL	5	0	0	1.666666667	3.333333333	1.666666667	1.666666667	INVALID				1.666666667	
MCH 31.8 pG	5	0	0	1.666666667	3.333333333	1.666666667	1.666666667	INVALID				1.666666667	
MCHC 33.7 g/dL	5	0	0	1.666666667	3.333333333	1.666666667	1.666666667	INVALID				1.666666667	
RDW-CV 11.6 %	5	0	0	1.666666667	3.333333333	1.666666667	1.666666667	INVALID				1.666666667	
Platelet Count 210 k/uL	5	0	0	1.666666667	3.333333333	1.666666667	1.666666667	INVALID				1.666666667	
MPV 9.5 fL	5	0	0	1.666666667	3.333333333	1.666666667	1.666666667	INVALID				1.666666667	
Neut% 54.9 %	5	0	0	1.666666667	3.333333333	1.666666667	1.666666667	INVALID				1.666666667	
Abs Neut (ANC)3.72 k/uL	5	0	0	1.666666667	3.333333333	1.666666667	1.666666667	INVALID				1.666666667	
Lymph% 32.0 %	5	0	0	1.666666667	3.333333333	1.666666667	1.666666667	INVALID				1.666666667	
Abs Lymph 2.18 k/uL	5	0	0	1.666666667	3.333333333	1.666666667	1.666666667	INVALID				1.666666667	
Mono% 9.0 %	5	0	0	1.666666667	3.333333333	1.666666667	1.666666667	INVALID				1.666666667	
Abs Mono 0.61 k/uL <	5	0	0	1.666666667	3.333333333	1.666666667	1.666666667	INVALID				1.666666667	
Eosin% 3.1 %	5	0	0	1.666666667	3.333333333	1.666666667	1.666666667	INVALID				1.666666667	
Abs Eosin 0.21 k/uL	5	0	0	1.666666667	3.333333333	1.666666667	1.666666667	INVALID				1.666666667	
Baso% 1.0 %	5	0	0	1.666666667	3.333333333	1.666666667	1.666666667	INVALID				1.666666667	
Abs Baso 0.07 k/uL	5	0	0	1.666666667	3.333333333	1.666666667	1.666666667	INVALID				1.666666667	
Nucleated Reds 0.1 /100 WBC	5	0	0	1.666666667	3.333333333	1.666666667	1.666666667	INVALID				1.666666667	
Absolute nRBC 0.01 k/uL	5	0	0	1.666666667	3.333333333	1.666666667	1.666666667	INVALID				1.666666667	
(The last two values were marked as "high." What does it mean?"	0	0	0	0	0	0	0					0	
Diff Type Auto Diff	0	0	0	0	0	0	0					0	
My doctor is young and stressed, didn't really hear out my issue, so can someone here tell me that everything looks normal as a second opinion.	5	5	5	5	0	0	0					5	
Sorry you are having so many seemingly unsolvable problems. This forum is for PMR and GcA. We have good experience with those disorders but we are not diagnosticians. I have a medical background and can tell you for sure that nicotine interferes with antidepressants. Regarding bloodwork: just because a reading is flagged H or L is not always relevant especially if it's off by only a couple of digits.	0	2	0	0.6666666667	0.6666666667	1.333333333	0.6666666667					0.6666666667	
I usually suggest to go for other doctors' opinions but the world is in crisis and all limited medical resources are in reserve for this.	0	0	0	0	0	0	0					0	
It doesn't sound like this forum meets your needs.	0	0	0	0	0	0	0					0	
When the world gets back to "normal" you might want to check out your cervical spine.	0	0	0	0	0	0	0					0	
You can start with going to a neurologist, neurosurgeon or orthopedic spine surgeon and they can order the appropriate tests ( MRI, CAT scan, EMG ).	0	0	0	0	0	0	0					0	
Issues with the hands can potentially originate from there.	0	0	0	0	0	0	0					0	
No-one here is qualified to interpret your results - we are all patients. This is also a forum specifically for a vasculitis that only older patients tend to develop which causes polymyalgia rheumatica and giant cell arteritis. It is extremely unlikely you have either at 24.	4	3	3	3.333333333	0.6666666667	0.3333333333	0.3333333333					3.333333333	
If you look at your results there will be a set of figures in brackets after each result - that is the normal range for your local lab. You can see that - we can't. You can see if they are normal.	0	0	0	0	0	0	0					0	
Why do you want to lower your iron level? That is well in normal range - I can tell you that much.	0	0	0	0	0	0	0					0	
This isn't the right forum for you I'm afraid.	0	0	0	0	0	0	0					0	
I appreciate the replies despite my ignorance. Thanks all.	0	0	0	0	0	0	0					0	
To address everything:	0	0	0	0	0	0	0					0	
I won't be seeing a doctor until the coronavirus is maintained. I definitely don't want to get any doctors sick, nor any of their patients who must see them.	3	3	2	2.666666667	0.3333333333	0.3333333333	0.6666666667					2.666666667	
I didn't use nicotine until after stopping antidepressants, but it is still good to know.	5	5	5	5	0	0	0					5	
I'll take a note about the cervical spine and follow that thread if I can't find another solution	1	1	1	1	0	0	0					1	
I want to lower my iron because my TIBC is low and my gene variants put me at risk for developing iron overload. Due to my desperation, I'm willing to try almost anything. I feel like my life is basically over at 24...too weak to do proper work, too tired to enjoy anything, and the things that bring me peace require my hands and the pain takes that from me. Bottom line is that I'm hurting too much to imply I'm healthy and it gets worse by the week. Ultimately, it is a desperate move to hopefully avoid future pain, even if my numbers are mostly healthy right now with a few exceptions that don't imply much.	5	5	4	4.666666667	0.3333333333	0.3333333333	0.6666666667					4.666666667	
Anyway, thanks for listening to my rant despite being in the wrong place. Thank you all. I hope you stay safe and healthy throughout this pandemic!	0	0	0	0	0	0	0					0	
There may be some other nutrient deficiency or imbalance, such as magnesium or salt. If you feel unwell there is no doubt a reason and it may take a lot of detective work to find out what the source of the problem is. Once you find it it may well be something very easily sorted. Keep on reading, but look for the simple answers first. Rare diseases are just that, rare so the chances you have one is rare. Good luck!	0	0	0	0	0	0	0					0	
The only thing I have to add (and again, no medical background here, but I think we all feel your pain....hang in there)....is be careful with the supplements. Some can cause toxicity....specifically B6 . Try to get most of what you need from food unless severely low. Will add you to my prayers.	0	0	0	0	0	0	0					0	
we are snowbirds who live in florida 6 months a year. yesterday they closed and locked all the buildings in our complex; only the outdoor sports areas (tennis, pickleball, etc.) are open(and empty). outdoor pools are limited as to visitors (we dont use them ever). so the question is do we drive across country to get home or shelter in place? lots of people are packing up and leaving, others are staying here.	0	0	0	0	0	0	0					0	
i have bronchitis, a residual from the flu last month. i was checked last week for pneumonia but chest xray was clear, no temperature. just cough syrup was recommended. we think we are staying here, at least for now. grocery stores are empty at home in the midwest where we live; there is food here (for now), although no wipes, toilet paper or sanitizers, etc. it will probably get worse as reality/panic sets in.	5	5	5	5	0	0	0					5	
i am just loathe to travel to motels, gas stations, restaurants, etc--a 3 day trip for us. the beaches are unbelievably crowded--kids on spring break who have no fear and no sense. we are planning to stay here, at least for awhile, but there is talk of closing interstates; of course motels are always risky, even in the best of times. im sheltering in; my cough scares people to death anyway. in the sunshine and heat at least i can sit outside, go for walks, talk to passersby, etc. but florida has lots of vulnerable old people, lots of silly spring breakers, lots of cases of coronavirus in the state. at home we would be very isolated in our subdivision, much more than here, which is why a lot of people are heading out asap...to get away from the crowds. thoughts on car travel?	2	0	0	0.6666666667	1.333333333	0.6666666667	0.6666666667					0.6666666667	
If you live there for 6 months out of the year, then it must feel like home. A gorilla run to your other home, where the grocery stores are empty, doesn't seem practical to me. Stay on your balcony, soak up the sun, listen or play music, paint, read, and hope for the best. Just my two cents, Twopies.	0	0	0	0	0	0	0					0	
Think my choice would be to stay put!	0	0	0	0	0	0	0					0	
You lucky thing, you have sunshine!! I would definately wait, just enjoy warm weather and sunshine, and wait,, because you would have to make stops on way home and you could feel more isolated when you get there. Get as much vit.. D as possible and hopefully this will be over soon. Be Blessed.	0	0	0	0	0	0	0					0	
Hi Twopies, I would stay put, it is not for ever, this will pass. I do not understand why people want to risk it. 🙂	0	0	0	0	0	0	0					0	
this is to thank everyone who replied; your suggestions mean a lot to me. the tally is 100% stay put...so we will. they just closed the restaurants and bars in our state back home. we are going to stay here, unless my husband gets trigger happy which i hope he wont. there is much to do back home in the spring, but our house and lawn will just have to wait, we have bigger worries right now. and we already decided that we would not go to our family easter gathering. i think that was the tipping point for him.	0	0	0	0	0	0	0					0	
people here are packing up left and right, the main expressway is at a standstill in some places.	0	0	0	0	0	0	0					0	
you all are right--this is a much better place to shelter in than up north. sending you sunshine, at least for the next few weeks.	0	0	0	0	0	0	0					0	
Plus, I bet they still have toilet paper!	0	0	0	0	0	0	0					0	
nope. none. someone (for a joke, i hope) has several rolls chained in their yard with a sign that says "$5 a roll."	0	0	0	0	0	0	0					0	
Omigod - three days to restaurants, gas stations? That's real isolation.	0	0	0	0	0	0	0					0	
New Zealand has just set some harsh rules, self-isolation for everyone coming into the country.	0	0	0	0	0	0	0					0	
For those of us over 70 with immunosuppressive conditions, we have to be extra vigilant, shopping only during off-peak times. There was an initial run on commodities - crazy stuff - but the mania has died down. There's plenty of loo paper.	3	3	3	3	0	0	0					3	
This was in our local newspaper the other day:	0	0	0	0	0	0	0					0	
American billionaires looking for a bolthole safe from the spread of coronavirus have been eyeing up New Zealand.	0	0	0	0	0	0	0					0	
One American family in New Zealand, which included elderly members, wanted to buy a New Zealand property but after discovering that - under foreign ownership laws - wasn't possible they switched to hunting for a luxury rental in the Bay of Islands. They could stay in New Zealand for three months as visitors but told real estate agent Graham Wall a border closure trapping the family here would be welcome.	0	0	0	0	0	0	0					0	
The wife, who's in her 80s, said, "Graham, if they shut the f***ing world and we're stuck in New Zealand that would be our dream come true."	0	0	0	0	0	0	0					0	
There's an upside to disasters. If there is a place to isolate - I'd choose the Bay of Islands as well. Just a four-hour journey from where I live.	0	0	0	0	0	0	0					0	
😂😂	0	0	0	0	0	0	0					0	
Keep well.	0	0	0	0	0	0	0					0	
Opua Harbour, Bay of Islands, NZ	0	0	0	0	0	0	0					0	
Hi Sandy,	0	0	0	0	0	0	0					0	
Wow! I just looked at your photo stream. You are a fantastic artist. I'm coming. We could have a grand ol time.	0	0	0	0	0	0	0					0	
I would choose Treble Cone. 🙂⛷	0	0	0	0	0	0	0					0	
If you can stand two weeks of self-isolation, thereafter, the welcome mat is laid out for you, Patricia.	0	0	0	0	0	0	0					0	
Definitely a grand ole time will be on the agenda.	0	0	0	0	0	0	0					0	
And this will be us.	0	0	0	0	0	0	0					0	
Never seen snow in my life - until I went up Coronet Peak. Ran out of the car and jumped into the bit of snow on the edge of the road - and disappeared. I was born in Ceylon. How was I know to about snow drifts!!	0	0	0	0	0	0	0					0	
Sandy, that is funny, there would be no way you would know. I have lived in snow country my entire life. I am sure there is much in the world that is that foreign to me. We have been fortunate that we have lived in the mountains and on the coast and enjoyed both. 🙂	0	0	0	0	0	0	0					0	
I agree you take beautiful photos. I would love to come and visit as well.	0	0	0	0	0	0	0					0	
I have heard from several medical people that sunshine is a disinfectant. So it would make sense to stay where you are. I live in Kansas (the midwest in the US) and things are closing fast, supplies are hard to come by. I've come to accept that I have to self isolate because I am a high risk patient. It's been cold and rainy here. I'd love to be in Florida. At least I could sit outside and enjoy my coffee in the morning.	4	4	3	3.666666667	0.3333333333	0.3333333333	0.6666666667					3.666666667	
i heard that too. im outside waiting for sunrise right now!	0	0	0	0	0	0	0					0	
Less that it is a disinfectant that would kill the virus (no proof of that) than that we are outside and further away from each other. But high humidity favours spread of the virus in droplet spread.	2	0	0	0.6666666667	1.333333333	0.6666666667	0.6666666667					0.6666666667	
then im sunk. 97% humidity every morning. lowers as day goes on. am keeping my distance, a lot are not. worrisome, indeed.	0	0	0	0	0	0	0					0	
Eileen - are you still in Italy? Keep safe.	0	0	0	0	0	0	0					0	
The victims are not just statistics. My long-time Flickr friend André Pipa posted a photo with a tribute: Vittorio Gregotti, the Italian architect who designed (with Portuguese architect Manuel Salgado) the Centro Cultural de Belém in Lisboa (1992) died in Milano, where he was hospitalized because of the coronavirus. This great master of modern Italian architecture was 92 years old. Rest in peace and thank you for creating such a stylish building in my home town.	0	0	0	0	0	0	0					0	
RIP Vittorio Gregotti.	0	0	0	0	0	0	0					0	
Twopies, reading on line this morning about virus and humidity. Most articles are saying the the viruses cannot survive in high humidity that is way normal flu season is in the dryer winter months. Check it out! 🙂	0	0	0	0	0	0	0					0	
The crazies are stockpiling toilet paper and hand sanitizer. When a Hamilton (NZ) craft beer and spirits brewery Good George manager tried unsuccessfully to buy some for his team, he decided to 'switch lanes' and make it for themselves and for the nation. "The whisky can wait," he said.	0	0	0	0	0	0	0					0	
Good on ya, George. (I love their beer)	0	0	0	0	0	0	0					0	
A brewery in Scotland and a gin company in the west of England are doing the same.	0	0	0	0	0	0	0					0	
Here is a piece I cut and pasted.	0	0	0	0	0	0	0					0	
There's no credible evidence ibuprofen either raises the risk for developing COVID-19, the illness caused by the coronavirus, or worsens the outcome of the disease.	0	0	0	0	0	0	0					0	
"There are no hard data at all saying that ibuprofen puts you at any kind of a disadvantage or interferes with the inflammatory response of the body such that it can't fight off the virus," Dr. William Schaffner, an infectious diseases expert at Vanderbilt University.	0	0	0	0	0	0	0					0	
Hello everyone. I was diagnosed with PMR 4 weeks ago. My rheumatologist put me on 20 mg of prednisone for 4 weeks, reducing to 15 mg , then to 5 mg until I return for my next visit in April. Last night I had severe leg cramps, Not just in the calves, but my entire leg. I have never had this before. Is this a side effect of the Prednisone? Before being diagnosed, I was in severe pain with major stiffness in pretty much all my joints. Very difficult to get out of bed and walk in the mornings. I just thought it was old age. I have always been a fairly active woman, and considered myself a young 67. But by the time I was 68, I felt I had aged 10 years. After 1 week on the prednisone I felt like a new woman. I don't feel quite as good now as I did 3 weeks ago, and will start reducing my dosage today. Is that normal? The information on this site has been so helpful. Thanks in advance for any information you my have on this matter.	5	5	5	5	0	0	0					5	
I have PRM and GCA my dr ordered me to take 550 mg potassium daily with my pred. I have done so and only had leg cramps once in 6 years of treatment.	5	5	5	5	0	0	0					5	
Hi Collen, I used to get cramps but i have been taking Magnesium for the last 5months and have only had it once since, do try it. Good Luck	5	5	5	5	0	0	0					5	
The first thing to try for the cramp is magnesium - pred makes you lose more magnesium through the urine. I'd be wary of taking more potassium without having had blood tests and medical advice.- too much potassium is dangerous. But you can increase the amount you eat of foods with plenty of potassium such as:	2	2	2	2	0	0	0					2	
Bananas, oranges, cantaloupe, honeydew, apricots, grapefruit (some dried fruits, such as prunes, raisins, and dates, are also high in potassium)	0	0	0	0	0	0	0					0	
Cooked spinach.	0	0	0	0	0	0	0					0	
Cooked broccoli.	0	0	0	0	0	0	0					0	
Potatoes	0	0	0	0	0	0	0					0	
Sweet potatoes.	0	0	0	0	0	0	0					0	
Mushrooms.	0	0	0	0	0	0	0					0	
Peas	0	0	0	0	0	0	0					0	
Cucumbers	0	0	0	0	0	0	0					0	
Because you felt so much better did you try to go back to normal activity levels? The pred has cured nothing - it just relieves the inflammation caused by the underlying autoimmune disorder that causes it and that leaves the actual illness chugging along in the background, attacking the muscles and leaving them intolerant of acute exercise. If you do too much you will develop DOMS, delayed onset muscle soreness, as if you had done far too much exercise, and it will take much longer than usual to resolve.	4	2	0	2	2	0	2	INVALID		INVALID		2	
Thanks. I started taking magnesium today. And yes, I did go back to my original activity level. My shoulders and knees are more painful than 3 weeks ago. I felt so good that I did not think about still having the disease and the prednisone is really just keeping it under better control. I will have to be more mindful if that.	5	5	5	5	0	0	0					5	
It is a mistake almost everyone makes at some point! You will get the hang of it eventually.	0	0	0	0	0	0	0					0	
